{
  "schema_version": "agent-dispatch.child-dispatch/v1",
  "child_id": "child-019c2234-5678-7abc-9def-0123456789ab",
  "aggregate_id": "019c2234-9abc-7def-8901-234567890abc",
  "dispatch_id": "019c2234-5678-7abc-9def-0123456789ab",
  "route_id": "wiki-maintenance",
  "destination_id": "wiki-primary",
  "destination_revision": "dst-5394fe54daf4b820811b90644e147bd8b0221f3836e0cb853a321d6368658b60",
  "workstream": "maintenance",
  "idempotency_key": "agent-dispatch:v2:sha256:eeeeeeeeeeeeeeeeeeeeeeeeeeeeeeeeeeeeeeeeeeeeeeeeeeeeeeeeeeeeeeee",
  "created_at": "2026-08-29T09:30:12.482Z"
}
